<?xml version="1.0" encoding="utf-8"?>
<?xml-stylesheet type="text/xsl" href="congty.xsl"?>

<congty xmlns:xsi="http://www.w3.org/2001/XMLSchema-instance" xsi:noNamespaceSchemaLocation="congty.xsd">
	<nhanvien manv="NV01">
		<hoten>Đặng Anh Phú</hoten>
		<luong>12700</luong>
		<phongban>
			<tenphong>Hành chính</tenphong>
			<dienthoai>0986218211</dienthoai>
		</phongban>
	</nhanvien>

	<nhanvien manv="NV02">
		<hoten>Phan Hồng Nam</hoten>
		<luong>8000</luong>
		<phongban>
			<tenphong>Nhân sự</tenphong>
			<dienthoai>0986216457</dienthoai>
		</phongban>
	</nhanvien>

	<nhanvien manv="NV03">
		<hoten>Nguyễn Thị Hồng</hoten>
		<luong>1921</luong>
		<phongban>
			<tenphong>Tai chinh</tenphong>
			<dienthoai>0938312124</dienthoai>
		</phongban>
	</nhanvien>
</congty>